<?xml version="1.0" encoding="UTF-8"?>
<!-- 被2013 sp1 () 使用XMLSpy v编辑的 (http://www.altova.com) by -->
<xs:schema xmlns:xs="http://www.w3.org/2001/XMLSchema">
	<xs:element name="info">
		<xs:complexType>
			<xs:sequence>
				<xs:element name="spy" minOccurs="0" maxOccurs="unbounded">
					<xs:complexType>
						<xs:sequence>
							<xs:element name="alias" minOccurs="0" maxOccurs="unbounded">
								<xs:complexType>
									<xs:simpleContent>
										<xs:extension base="xs:string">
											<xs:attribute name="aID">
												<xs:simpleType>
													<xs:restriction base="xs:integer">
														<xs:minInclusive value="1"/>
														<xs:maxInclusive value="7"/>
													</xs:restriction>
												</xs:simpleType>
											</xs:attribute>
										</xs:extension>
									</xs:simpleContent>
								</xs:complexType>
							</xs:element>
							<xs:element name="mission" minOccurs="0" maxOccurs="unbounded">
								<xs:complexType>
									<xs:sequence>
										<xs:element name="date">
											<xs:simpleType>
												<xs:restriction base="xs:string">
													<xs:pattern value="\d{4}/\d{1,2}/\d{1,2}"/>
												</xs:restriction>
											</xs:simpleType>
										</xs:element>
										<xs:element name="description" type="xs:string"/>
										<xs:element name="status">
											<xs:simpleType>
												<xs:restriction base="xs:string">
													<xs:enumeration value="Mission Accomplished"/>
													<xs:enumeration value="In Progress"/>
												</xs:restriction>
											</xs:simpleType>
										</xs:element>
									</xs:sequence>
									<xs:attribute name="mID" type="xs:string"/>
								</xs:complexType>
							</xs:element>
						</xs:sequence>
						<xs:attribute name="spyID" type="xs:string"/>
						<xs:attribute name="firstName"/>
						<xs:attribute name="lastName"/>
					</xs:complexType>
				</xs:element>
			</xs:sequence>
		</xs:complexType>
	</xs:element>
</xs:schema>
